{
  "schemaVersion": "1.0.0",
  "generatedAt": "2026-08-14T00:00:00Z",
  "totalSutras": 555,
  "records": [
    {
      "id": "BS-1-1-1",
      "number": "1.1.1",
      "adhyaya": 1,
      "pada": 1,
      "sutra": 1,
      "slug": "atha-ato-brahma-jijnasa",
      "title": "Atha Ato Brahma Jijñāsā",
      "path": "content/sutras/BS-1-1-1.json"
    },
    {
      "id": "BS-1-1-2",
      "number": "1.1.2",
      "adhyaya": 1,
      "pada": 1,
      "sutra": 2,
      "slug": "janmady-asya-yatah",
      "title": "Janmādy Asya Yataḥ",
      "path": "content/sutras/BS-1-1-2.json"
    },
    {
      "id": "BS-1-1-3",
      "number": "1.1.3",
      "adhyaya": 1,
      "pada": 1,
      "sutra": 3,
      "slug": "sastra-yonitvat",
      "title": "Śāstra-Yonitvāt",
      "path": "content/sutras/BS-1-1-3.json"
    }
  ]
}
